<?xml version="1.0" encoding="UTF-8"?>
<!DOCTYPE cv SYSTEM "cv.dtd">
<?xml-stylesheet type="text/xsl" href="../xsl/cv2html5.xsl"?>

<cv lang="fr" suffix="_clement_desiles_2020">
  <contact title="Contact">
    <name title="Name">Cl√©ment D√©siles</name>
    <title>D√©veloppeur Node.js exp√©riment√© - Ing√©nieur avant-vente</title>
    <info>31 ans ‚Äì permis de conduire B</info>
    <phone>+33 6 58 12 45 61</phone>
    <email>clementdesilesfr@gmail.com</email>
    <homepage>https://clementdesiles.fr</homepage>
    <photo width="128">img/photo.png</photo>
    <keywords>curriculum vitae, pre-sales engineer, engineering, Node.js, full-stack, Linux, CI, CD, Ansible</keywords>
  </contact>

  <section title="Formation">
    <subsection title="Dipl√¥me d‚Äôing√©nieur, grade de Master" date="2007‚Äì2012">
      <item>Ecole Nationale d‚ÄôIng√©nieurs de Brest (<a href="https://www.enib.fr">ENIB</a>), France</item>
    </subsection>
    <subsection title="Semestre de mobilit√© √† l‚Äô√©tranger" date="2012">
      <item>Universit√© de Cadix (<a href="https://www.uca.es">UCA</a>), Espagne</item>
    </subsection>
  </section>

  <section title="Exp√©rience">
    <subsection title="Ing√©nieur avant-vente, Hoppen (ex. T√©l√©com Sant√©)" date="depuis juin 2016 ‚Äì 4 ans">
      <item>Avant-vente : mise en place de kits de d√©monstration, showroom, r√©ponse √† appel d'offre, chambres t√©moin, r√©alisation de devis.</item>
      <item>Export : accompagnement √† l‚Äôinternational (Portugal, Suisse, Quatar, Arabie Saoudite, Antilles), r√©ponse aux appels d‚Äôoffre, d√©mos, <dfn>KAM</dfn> et d√©ploiement.</item>
      <item>Lead dev : packaging <dfn>Docker</dfn>, migration de 800 sources logicielles <dfn>Gitlab</dfn>, mise en place de CI/CD (<dfn>Gitlab Runners</dfn>, <dfn>Ansible</dfn>, <dfn>Artifactory</dfn>). D√©ploiement de <dfn>Jira</dfn> pour nos 300 employ√©s.</item>
      <item>Interconnexion : dossiers m√©dicaux, radiographies, commande de repas, facturation, <dfn>GMAO</dfn>, <dfn>SSO</dfn>, domotique (<dfn>Siemens</dfn>, <dfn>KNX</dfn>).</item>
      <item>S√©curit√© : analyse de risque, hardening, veille, syst√®mes de paiement et d‚Äôauthentification.</item>
      <item>Handicap : POC d'IHM √† destination des personnes handicap√©es mentales et physique (contacteur sec, balayage au souffle, contr√¥le r√©tinien).</item>
    </subsection>
    <subsection title="VIE Architecte d√©veloppeur, Revevol Milan" date="mai 2015 √† mai 2016 ‚Äì 1 an">
      <item>Intranet international de 60 000 utilisateurs pour Lafarge-Holcim : devops d‚Äôune application <dfn>Google App Engine</dfn>.</item>
      <item>Migration des archives d'Airliquide dans le Cloud : d√©veloppement d'application web distribu√©e (US / Europe) sharding <dfn>MongoDB</dfn> dans la <dfn>GCP</dfn>.</item>
      <item>Outil IT de gestion de mobiles pour Solvay : application Web de gestion d'acc√®s pour les 30 000 smartphones connect√©s au domaine de l‚Äôentreprise (<dfn>Apps for Work</dfn>).</item>
    </subsection>
    <subsection title="D√©veloppeur full stack, T√©l√©com Sant√©" date="septembre 2012 √† avril 2015 ‚Äì 3 ans et 6 mois">
      <item>D√©veloppeur : architecture d'applications web tactiles, <dfn>responsive design</dfn>, i18n, migration de code legacy.</item>
      <item>Encadrement : formation et suivi de stagiaires, transfert de comp√©tences, coordination de projet.</item>
      <item>Conception : analyse, cahier des charges, sp√©cifications logicielles, int√©gration, tests, packaging.</item>
      <item>Syst√®me : support de tablettes tactiles sous <dfn>Linux</dfn>, <dfn>reverse engineering</dfn>, √©criture de drivers, bindings <dfn>C</dfn>/<dfn>Node.js</dfn>.</item>
    </subsection>
    <subsection title="Stage ing√©nieur, T√©l√©com Sant√©" date="de f√©vrier 2012 √† ao√ªt 2012 ‚Äì 6 mois">
      <item>Au sein d'une jeune startup (2 fondateurs, un dev senior et moi-m√™me), d√©veloppement d'une tablette √† destination des patients hospitalis√©s. Support <dfn>Linux</dfn>, d√©veloppement d‚Äôapplications <dfn>Web</dfn> et <dfn>Node.js v0.6</dfn>.</item>
    </subsection>
    <subsection title="Auto-entrepreneur, d√©veloppement logiciel" date="de septembre 2011 √† ao√ªt 2012 ‚Äì 1 an">
      <item>R√©alisation d‚Äôune plate-forme <dfn>e-Commerce</dfn> pour le site <a href="https://worldgift.com">WorldGift</a>.</item>
    </subsection>
    <subsection title="Stage, Telemotive, Munich" date="de juin 2010 √† d√©cembre 2010 ‚Äì 6 mois">
      <item>Au coeur de l'industrie automobile, d√©veloppement de services <dfn>UPnP</dfn> sur des cartes embarqu√©es <dfn>Linux</dfn> / <dfn>PowerPC</dfn>. √âtudes d'encapsulation de trames <dfn>Ethernet</dfn> dans un r√©seau fibre optique <dfn>MOST</dfn>. Analyse de performances (<dfn>Python</dfn>).</item>
    </subsection>
    <subsection title="Assistant Webmaster, PMB Services" date="de juin 2007 √† juin 2010 ‚Äì 3 ans">
      <item>Contributions √† un logiciel de gestion de biblioth√®que en <dfn>PHP</dfn> / <dfn>MySQL</dfn>, r√©alisation de chartes graphiques, d‚Äôinterfaces Web et du <a href="https://www.sigb.net">site internet</a> de la soci√©t√© avec le framework <dfn>SPIP</dfn>.</item>
    </subsection>
  </section>

  <section title="Comp√©tences">
    <subsection title="Informatique g√©n√©rale">
      <item>Langages : <dfn>Node.js, Python, C, C++, bash</dfn></item>
      <item>Administration syst√®me : <dfn>Ubuntu, Archlinux, LFS, Ansible, systemd</dfn></item>
      <item>Bases de donn√©es : <dfn>MongoDB, MySQL, PostGreSQL</dfn></item>
      <item>Virtualisation : <dfn>VMWare / VSphere, Virtualbox, Qemu</dfn></item>
      <item>CI / CD : <dfn>Ansible, Gitlab ci/runners, Artifactory, docker-compose</dfn></item>
      <item>Gestion de versions : je ma√Ætrise parfaitement <dfn>GIT</dfn> (int√©grateur logiciel)</item>
    </subsection>

    <subsection title="Web">
      <item>Technologies : <dfn>Javascript ES6, HTML5, CSS3, Websocket, WebRTC</dfn></item>
      <item>Frameworks : <dfn>VueJS, AngularJS, PolymerJS</dfn></item>
      <item>Packaging et tests : <dfn>Docker, npm, mocha, ava, ajv, ESLint/xo</dfn></item>
      <item>Serveurs : <dfn>Nginx, Apache, ExpressJS, Django</dfn></item>
    </subsection>

    <subsection title="R√©seau et plateformes">
      <item>R√©seau : <dfn>VLAN, Wi-Fi, Load Balancer, routage, sharding</dfn></item>
      <item>Services : <dfn>DHCP, proxy, reverse-proxy, SSH, VPN</dfn></item>
      <item>Protocoles : <dfn>HTTP, SSL/TLS, HLS, DNS, PC/SC</dfn></item>
      <item>Cloud : <dfn>GCP, OVH Cloud, Azure</dfn></item>
    </subsection>

    <subsection title="Avant-vente">
      <item>R√©ponse √† appel d'offre, soutenances, pr√©sentations et formations.</item>
      <item>R√©alisation de kits de d√©monstration, showrooms multi-produit et multi-lingue.</item>
      <item>Adaptations clientes sp√©cifiques, gestion de budget, gestion de projet.</item>
      <item><dfn>Key Account Manager</dfn> √† l'international, d√©ploiements, support N3.</item>
    </subsection>

    <subsection title="Langues" class="table">
      <item>Anglais (courant, TOEIC 905)</item>
      <item>Italien (courant, emploi en Italie)</item>
      <item>Espagnol (interm√©diaire, √©tudes en Espagne)</item>
      <item>Allemand (d√©butant, stage en Allemagne)</item>
    </subsection>
  </section>

  <section title="Loisirs">
    <item>üß≥ rencontres interculturelles (Bretagne, Bosnie-Herz√©govine, Serbie, Allemagne), voyages en inter-rail, membre actif de la communaut√© <a href="https://www.couchsurfing.com/people/clementdesiles">CouchSurfing</a>.</item>
    <item>üéµ passionn√© de concerts et de festivals de musique, je joue du piano depuis mes 6 ans, de la fl√ªte irlandaise et j‚Äôapprends le violon.</item>
    <item>üßó je pratique l‚Äôultimate frisbee, et suis amateur d‚Äôescalade et de kayak. J‚Äôadore cuisiner de (d√©licieuses) lasagnes open source.</item>
  </section>
</cv>
